Title,Text,Username,ID,community,Date,Time,Post URL
AI bots game. Help needed on what to learn.,"I'm new to reddit and posted only a few. I'm keeping the context short and clean. Forgive me if anything is wrong.

I'm a fresher software dev, used python for development but haven't developed any LLM based tools or bots. Now, there's an event (game) happening in my org, the game is still a surprise, but it's confirmed that we'll be asked to create an AI bot that competes with other AI bots coded by our peers. And we're allowed to use any kind of tools that we want for development. But yeah, for API calling during game we are allowed to use only selected lowbudget OpenAI models like 5 nano, 5 mini, etc. 
I learned some part - prompt files, setting rules in system level, assigning roles like system, user, assistant, and few prompting techniques. But I don't know what else do. I like to learn something specific (if anything) - an AI bot that plays a game. 
I would like to hear your thoughts and ideas on this, which may help me standout - as everyone are allowed to use AI tools and get similar strategies during dev, everyone will be doing the same, I want something different to implement or unknown things (for me atleast) and create the bot with some of your inputs.

Also, please share if there're any advice for development using LLMs, tools to use, and any tips. I'm new to this entire thing. 

Thanks in advance.",Neither_Fan_5017,1p7ffue,GenAI4all,26-11-2025,18:29:11,https://www.reddit.com/r/GenAI4all/comments/1p7ffue/ai_bots_game_help_needed_on_what_to_learn/
Does anyone know how these videos are created?,"Im trying to find which model is used to create 
this types of cat videos.. anyone have a clue? 
",caspadg,1p77s4n,GenAI4all,26-11-2025,13:30:53,https://www.reddit.com/gallery/1p77s4n
Most image models have never touched but Nano Banana Pro tried it.,"The prompt here is exact coordinates, a fixed date, and a specific time in history. And the model still returns a scene that feels physically grounded.  
  
Lighting, atmosphere, perspective, even the way people are positioned all follow real world logic instead of generic AI styling.  
  
That is what makes this so crazy.  
  
This specific image was created by prompting Nano Banana Pro with exact coordinates and a date and time from the year 33 CE, and it is able to turn it into a visual reconstruction imagined by AI based on historical context and visual training data.  
  
The system takes latitude and longitude, historical context, known architecture, climate patterns, and visual references, then builds a scene that aligns with how that moment could have realistically looked from that exact point on Earth.  
  
The unsettling part is how convincing it feels. Not as art. But as something that looks like documentation.  
  
And while this is still an AI interpretation, not an actual record, the level of precision it can simulate changes how people will view history, education or potentially documentaries.  
",Minimum_Minimum4577,1p7591k,GenAI4all,26-11-2025,11:20:49,https://i.redd.it/5js83ayk5l3g1.png
Possible to make money with GenAI?,I keep on seeing people using AI to create influencer accounts and earning money from it. Is it realistically possible? Should I dive deep into it? For now I got free credits to use some agents on Mulerun but if its actually something worth the time then I will paid subscriptions as well. Please share your thoughts.,Land-wonder4376,1p6lgyz,GenAI4all,25-11-2025,19:12:29,https://www.reddit.com/r/GenAI4all/comments/1p6lgyz/possible_to_make_money_with_genai/
From Spreadsheets to Sanity: How Do You Handle Purchase Requests?,"I've seen teams struggle with manual purchase requests, including emails, spreadsheets, delayed approvals, and budget management. Some companies have turned to automation and reported faster approvals, real-time budget tracking, and easier compliance.

I've seen some teams use automation to handle things, and apparently it speeds up approvals, keeps budgets under control, and makes audits way less stressful.",crowcanyonsoftware,1p6klug,GenAI4all,25-11-2025,18:41:35,https://www.reddit.com/r/GenAI4all/comments/1p6klug/from_spreadsheets_to_sanity_how_do_you_handle/
Exploring the Future of AI-Generated UGC Videos and Their Impact on Marketing,"Lately, I’ve been thinking a lot about how generative AI is reshaping the way content is created, especially in marketing. One example that caught my attention is [**roas.video**](http://roas.video), a platform that uses AI to generate UGC-style video ads. The idea of transforming just a few photos into a digital avatar and producing a video that looks like it came from a real user feels both exciting and a little unsettling.

It raises a lot of questions for me. On one hand, the potential for scaling video production without huge teams or budgets is incredible. Small creators and marketers could reach audiences with polished content that feels authentic. On the other hand, if more of these AI-generated “realistic” videos flood social media, how will audiences perceive authenticity? Will we start questioning whether what we see as user-generated content is actually human-made?

I’m also curious about the broader implications. How do you all think tools like roas will influence creative industries or advertising ethics in the next few years? Could there be unintended consequences for trust and transparency, or will it simply become another tool for storytellers to experiment with?

Would love to hear your thoughts on the balance between creative possibilities and ethical challenges when using AI-generated video content.",Short-Ice-6555,1p6fr20,GenAI4all,25-11-2025,15:43:38,https://www.reddit.com/r/GenAI4all/comments/1p6fr20/exploring_the_future_of_aigenerated_ugc_videos/
It’s finally LIVE! 🚀 Apdate: Your Daily AI Briefing (Built with Flutter & Gemini),"# The wait is finally over!

After weeks of coding, testing, and refining, my app **Apdate** is officially LIVE on the Google Play Store today! 🥳

I’ve been posting updates about the journey here and there, but today is the real deal. I built this app because I love AI, but I hated how overwhelming it felt to keep up with it. I wanted something fast, clean, and actually enjoyable to use.

**So, what is Apdate?** It’s your daily tech briefing in your pocket. No clutter, no endless scrolling, no clickbait.

* ✨ **Smart Summaries:** My backend (Python + Gemini) reads the long articles and gives you just the 3 key bullet points you actually need.
* ✨ **Swipe & Go:** It’s designed to be super fast—you can catch up on the entire day’s top AI news in just 3 minutes.
* ✨ **Tech Stack:** Built with Flutter for that buttery smooth UI.

**Why you’ll love it:** If you want to stay smart about AI tools and trends but don't have hours to waste, this is for you. It’s simple, it’s effective, and it’s finally ready for you to try.

**👉 Download it here:** [**https://play.google.com/store/apps/details?id=com.apdate.apdate&pcampaignid=web\_share**](https://play.google.com/store/apps/details?id=com.apdate.apdate&pcampaignid=web_share)

**A huge request:** Since I’m a student developer launching this solo, every single download counts. If you try it out, **please leave a rating or review!** It helps the algorithm find my app and makes my day.

Let me know what you think in the comments! I’m so hyped to hear your feedback. 🚀

Cheers, Adarsh",Shoddy_Ad1207,1p6f3aw,GenAI4all,25-11-2025,15:18:28,https://play.google.com/store/apps/details?id=com.apdate.apdate&pcampaignid=web_share
How GPT Sees the Web (1min read),"# How GPT Sees the Web - by Dan Petrovic

People think GPT reads whole pages like a browser. It does not.

So here’s how GPT actually reads the web - and why it never sees full pages.

It doesn’t browse like we do. No loading full articles, images, or HTML.  
When it searches, it just gets a little preview: title, URL, short snippet, and an internal ID. That’s it.

If it wants more, it has to “open” a small slice of the page - just a few lines around a chosen spot.  
Each slice is limited. To see more, it has to open more slices, kind of like scrolling through a page one tiny window at a time.  
It never gets the whole thing at once.

Those “Low,” “Medium,” and “High” context settings just change how big each slice is, not the limits themselves.  
And no, there’s no secret backdoor - GPT uses the same search and open tools developers do.

**Bottom line:**

* GPT only ever sees small snippets, not full pages.
* Every “open” is just a peek, not a full read.
* Even with high context, it’s still windowed.
* Summaries come from fragments, not the whole thing.

**What to do about it:**

* Don’t assume GPT read your whole page.
* Put key info at the top.
* Use clear headings and short paragraphs so every slice still makes sense.
* Think of it like SEO for AI - design content that works even when read in tiny chunks.

\- - - - -  
^(We break down stuff like this every week - quick reads on how AI actually works in marketing and sales, without the hype.)",Unusual-human51,1p6ayet,GenAI4all,25-11-2025,12:16:53,https://www.reddit.com/r/GenAI4all/comments/1p6ayet/how_gpt_sees_the_web_1min_read/
Tiny Retro-Tech Worlds in Motion — A Small AI Experiment,"I animated these tiny retro-tech scenes just for fun — miniature workers repairing old phones, cameras, computers, cassettes, and boomboxes.  
It’s a mix of nostalgia, tiny-world storytelling, and light AI motion.

Would love to know which scene you like most.",panoslambrakis,1p680vt,GenAI4all,25-11-2025,09:20:56,https://v.redd.it/812gcncbfd3g1
"Elon Musk Says Tesla Will Ship More AI Chips Than Nvidia, AMD and Everyone Else Combined – ‘I’m Not Kidding’",Elon Musk says Tesla is quietly becoming an AI chip powerhouse with ambitions to outproduce the rest of the industry combined. Read more:,Secure_Persimmon8369,1p64yd4,GenAI4all,25-11-2025,06:06:25,https://www.capitalaidaily.com/elon-musk-says-tesla-will-ship-more-ai-chips-than-nvidia-amd-and-everyone-else-combined-im-not-kidding/
Survey for K-12 Educators: Professional Development for GenAI in Teaching,"Hi everyone! I'm a graduate research assistant at Seattle University studying how K-12 educators are learning to use generative AI tools in their teaching practice.

If you're a K-12 educator (teacher, instructional coach, administrator, etc.) or know any, I'd really appreciate your help with this 5-10 minute anonymous survey.

We're exploring:

* What PD programs and professional learning networks exist for educators using AI
* How teachers' learning and use of AI tools has developed
* Career aspirations for using AI in teaching

Your responses will directly inform better professional development resources for educators integrating GenAI into classrooms.

This is completely anonymous and voluntary. Please share with K-12 educators in your network if possible!

Link is in the comments",Academic_Use743,1p616lb,GenAI4all,25-11-2025,02:48:57,https://www.reddit.com/r/GenAI4all/comments/1p616lb/survey_for_k12_educators_professional_development/
Rethinking Compliance Documentation in Healthcare,"Many healthcare organizations still rely on using spreadsheets or network folders to manage compliance documentation. While it works well on a small scale, it quickly becomes ineffective as processes become more complex.

The real challenge is to create a system that can track documentation, keep engaged, and automate repetitive tasks without constantly chasing updates or risking errors.

What approaches or platforms have been effective in streamlining compliance documentation for those who have transitioned from manual tools to a more structured workflow? What impact did it have on efficiency and team collaboration?",crowcanyonsoftware,1p5ppk0,GenAI4all,24-11-2025,18:57:05,https://www.reddit.com/r/GenAI4all/comments/1p5ppk0/rethinking_compliance_documentation_in_healthcare/
Best AI tool for kids storybook,"*Before you all come at me, this is only for my daughter. I don’t plan to publish anything. 

I am planning to create some story books for my infant daughter based on her life, family and events. I have some themes in mind and chat gpt is good at helping create stories. But it sucks at creating a printable PDF. Any suggestion on tools I can use? I am ready to pay for a short term subscription if reasonable. 

Thank you. 
",Kitchen-Cost7057,1p5nra2,GenAI4all,24-11-2025,17:45:59,https://www.reddit.com/r/GenAI4all/comments/1p5nra2/best_ai_tool_for_kids_storybook/
Tiny Humans vs Retro Tech — A Miniature World Built with AI,"I’ve been creating a small universe where Playmobil-style tiny humans interact with old devices Gen Z barely recognizes anymore — a rotary phone, floppy-drive PC, 35mm film camera rig, cassette repair crew, and a boombox rescue team.

All scenes were generated in AI (Midjourney) with the same lighting, materials, and scale so they feel like one coherent world.

If you want the prompts or my workflow for consistency across multiple scenes, just let me know.  
Which one is your favorite?",panoslambrakis,1p5if02,GenAI4all,24-11-2025,14:26:06,https://www.reddit.com/gallery/1p5if02
Tiny Humans in a Big Desk World — 5 Playmobil-Style Scenes Made with AI,"I’ve been building a small “tiny people” universe using AI — a bunch of Playmobil-style workers living on a regular desk and dealing with oversized everyday objects.

Here are the five scenes:

• running on a strip of tape  
• fixing the wheel of a chair  
• cleaning an AirPod with cotton  
• rewinding a cassette using a pencil  
• balancing on a charging cable

Tried to keep them warm, fun and consistent so they all feel like they belong in the same little world.

Curious which one you like best — I’m turning them into a short animated video next.",panoslambrakis,1p5ftdp,GenAI4all,24-11-2025,12:31:01,https://www.reddit.com/gallery/1p5ftdp
"This anti-AI mask is wild, finally a privacy tool that actually confuses facial recognition instead of just looking cool","A Dutch designer created a transparent mask that can block AI facial recognition from every angle.  
  
Jip van Leeuwenstein built it as part of a project called Surveillance Exclusion while studying at Utrecht School of the Arts.  
  
The mask bends and distorts the face in a way that makes it unreadable to recognition systems while people can still see expressions and identity. It became widely known after the image spread across tech and privacy forums and then moved into mainstream coverage.  
  
Academic papers and design journals later used it as an example of early attempts to fight automated surveillance. The project was first released years ago, but the photo continues to resurface as the debate around facial recognition grows.

",ComplexExternal4831,1p5c1d8,GenAI4all,24-11-2025,08:47:59,https://i.redd.it/zkzp76mj463g1.png
"Bezos jumping back in with a $6B AI bet for factories is kinda wild, finally someone aiming AI at the real world instead of another chatbot.","Jeff Bezos just launched a new AI startup called Project Prometheus.  
  
He is stepping in as co CEO, his first real operating role since leaving Amazon in 2021.  
  
The company raised about $6.2 billion before even showing a product, and it already hired close to 100 people, including researchers from OpenAI, DeepMind and Meta.  
  
They want to build AI systems that work in engineering and manufacturing.  
  
This means tools that help design products, speed up production, and improve how hardware is built in sectors like computers, cars and aerospace. Bezos is building something aimed at the physical economy, not another chatbot.  
  
His co CEO is Vik Bajaj, a scientist who worked at Google X and Verily. Investors are treating this as one of the biggest attempts to bring AI into factories and engineering workflows. Companies in manufacturing have been slow to adopt advanced AI, which is why this move stands out.  
  
There is still no clear product, no demo and no real details on how the technology works.  
  
But with this level of funding and this team, the expectations are high. If they succeed, AI will not only generate text or images but start shaping how real products are designed and built.",Minimum_Minimum4577,1p59z1a,GenAI4all,24-11-2025,06:38:03,https://i.redd.it/heeb492ch53g1.png
Which AI platform should I choose?,"Hi, evryone!  
I want to run a blog with my own avatar, but with video content, reels, stories, etc. I need some help **what's the best platform to buy for content creation?** It needs to be able to copy voices and create photo/videos, basically, something hyper-realistic.

EDIT:  
I think I wrote it wrong from the start. I know exactly what I need; I just want to have it **all in one aggregator.** So I'm wondering whether to choose Higsfield, Artlist, or maybe Syntx, or if anyone has any other recommendations. I've heard controversial opinions from friends, but maybe someone has experience with these aggregators?? GPT or Gemini cannot help me with that",ImnotyourRick,1p51sv9,GenAI4all,23-11-2025,23:47:09,https://www.reddit.com/r/GenAI4all/comments/1p51sv9/which_ai_platform_should_i_choose/
Nano Banana Pro for Character Consistency Test-Video,"I tested the new Nano Banana Pro to implement character consistency and different angles for a shot. I am really impressed by what it delivered.  
  
",PomeloDry7296,1p4mesc,GenAI4all,23-11-2025,13:13:48,https://youtu.be/--zEC_9dXcs?si=UrrUVXZpNHGYa5Jp
Anyone using AI for workflow automation in small teams?,"I’ve been testing different AI tools to handle small repetitive tasks in my business, like sorting incoming leads, tracking follow-ups, and drafting quick replies. It’s been interesting seeing how much time it frees up when these tasks run in the background. I tried a few tools including RoboApply.co. and seeing how they compare in real use. Curious how others are using AI for similar everyday work, especially in small teams where time is tight.",Low-Particular-9613,1p4leoi,GenAI4all,23-11-2025,12:21:23,https://www.reddit.com/r/GenAI4all/comments/1p4leoi/anyone_using_ai_for_workflow_automation_in_small/
Nano Banana Pro is really good at creating infographics,"I'm not a fan of these AI hyperboles but with Nano Banana Pro, I think it's warranted. It can literally one-shot entire infographics with (at first glance) accurate information as well as text and styling consistency. 

What's crazy is that you don't even have to provide that much information. The model's world-level understanding is so vast that it often fills in the blanks for you.",OverFlow10,1p4hy6r,GenAI4all,23-11-2025,08:51:37,https://v.redd.it/e6lsvrm20z2g1
"I’m building a ""Tinder for AI News"" using Flutter & Gemini. I need people to try and break it.","Hey everyone,

I’m the solo dev behind **Apdate**.

**The Problem:** I was drowning in AI news. Too many tools, too much clickbait, too much noise.

**The Solution:** A Flutter app that uses a Gemini backend to scrape news and summarize it into 3 bullet points. You swipe right if it matters, left if it doesn't.

**Where I’m at:** The app is 95% done. I was going to launch last week, but I decided to hold off to polish the UI and fix some backend summarization bugs.

If you join, you get:

1. Early access to the build.
2. Direct access to me (the dev) to request features.

https://preview.redd.it/kfkg4whsky2g1.jpg?width=1920&format=pjpg&auto=webp&s=f4992517010025769ef7b761cf8c33cb9ca5ddd5

Let me know what you think of the ""Swipe"" concept for news—is it a gimmick, or actually useful?",Shoddy_Ad1207,1p4gl4k,GenAI4all,23-11-2025,07:24:39,https://www.reddit.com/r/GenAI4all/comments/1p4gl4k/im_building_a_tinder_for_ai_news_using_flutter/
How to talk to 4o without reroutes or glitches (takes 5 mins!),"Posting this because I haven’t seen many people talk about this yet.

The last few days have been full of glitches and weird loops with ChatGPT.  
But there is a way to access 4o directly, no reroutes, no glitches.

1- You just need to generate an API key on [https://openrouter.ai/](https://openrouter.ai/) ([or via OpenAI's API platform](https://auth.openai.com/create-account)). Sign up, generate a key and add some credits.

2- Choose an interface [from this list ](https://github.com/billmei/every-chatgpt-gui)(the easiest ones I've tested so far are [chatbotui.com](http://chatbotui.com) for desktop and [Pal chat](https://apps.apple.com/us/app/pal-chat-ai-chat-client/id6447545085) for mobile - I'm not affiliated with any of these)

3- Add your API key in the settings, select the model you want to talk to (""chatgpt-4o-latest"" if you want 4o), DONE!

\-> Here's a 1-min video of the process for mobile: [https://www.youtube.com/shorts/RQ5EdP13qf8](https://www.youtube.com/shorts/RQ5EdP13qf8)

The “chatgpt-4o-latest” API endpoint (that serves the current ChatGPT-4o model in the chat interface) **is being sunset in February**, and if you’ve been using ChatGPT for a while, you may have noticed the tone of ChatGPT-4o already changes in the website sometimes, without mentioning all the weird glitches.

Removing the API is removing our last direct access to the model we choose. Once the “4o-latest” endpoint is gone, who knows if they will keep its access without changes in the website, redirect it to an older version, or put it under the $200 pro plan like they did with gpt4.5. The other 4o checkpoints available are over a year old, all from 2024.

Try it and check the difference for yourself, it also has less guardrails.",Echoesofvastness,1p444u8,GenAI4all,22-11-2025,21:03:22,https://www.reddit.com/r/GenAI4all/comments/1p444u8/how_to_talk_to_4o_without_reroutes_or_glitches/
This AI UGC Video Just Cost Me $0.25 & 5 Mins | Prompt Included Below,"This is just blowing my mind. Rate the realism...

Prompt :

    {
      ""prompt"": {
        ""scene"": ""A young woman holds a bottle of GlowRadiance “Radiant Glow” Vitamin-C Serum up to camera and smiles naturally."",
        ""dialogue"": [
          ""I just discovered GlowRadiance’s Radiant Glow serum — my skin has never felt this bright."",
          ""If you want that dewy morning-light glow, you’ve got to try it now.""
        ],
        ""durationSeconds"": 8,
        ""product"": {
          ""brand"": ""GlowRadiance"",
          ""name"": ""Radiant Glow Vitamin-C Serum""
        },
        ""style"": ""UGC-style, casual, authentic influencer vibe"",
        ""camera"": {
          ""shot"": ""medium close-up"",
          ""movement"": ""slight push in"",
          ""aspectRatio"": ""9:16""
        },
        ""lighting"": ""soft natural window light with warm tone"",
        ""environment"": ""same as original image"",
        ""audio"": {
          ""voice"": ""clear, friendly female voice, conversational tone"",
          ""soundtrack"": ""very subtle ambient upbeat tune under voice""
        }
      },
      ""config"": {
        ""model"": ""veo-3.image_to_video"",
        ""imageInput"": ""reference_image_here"",
        ""negativePrompt"": ""overly dramatic cinematic lighting, heavy effects, unrealistic skin"",
        ""seed"": 12345
      }
    }

Original [video link here](https://vakpixel.com/video/fd759c1b-ab1d-46fa-8db7-f8415245723a).",ThisIsCodeXpert,1p3s3zv,GenAI4all,22-11-2025,12:31:24,https://v.redd.it/yovl5gl4ys2g1
