Title,Text,Username,ID,community,Date,Time,Post URL
"Why ""everyone dies"" gets AGI all wrong, 'Do not trust your eyes': AI generates surge in expense fraud and many other AI links from Hacker News","Hey everyone, I just sent issue #6 of the [Hacker News x AI newsletter](https://eomail4.com/web-version?p=01b6f55e-bb2d-11f0-bcb3-f3feb971b4f0&pt=campaign&t=1762449036&s=6c02d5c73d0e771e31a7b8cbd3d757a918a84b30ffe1f438d77c0ceface5e59f) \- a weekly roundup of the best AI links and the discussions around them from Hacker News. See below some of the news (AI-generated description):

*I also created a dedicated subreddit where I will post daily content from Hacker News. Join here:* [***https://www.reddit.com/r/HackerNewsAI/***](https://www.reddit.com/r/HackerNewsAI/)

* **Why “everyone dies” gets AGI all wrong** – Argues that assuming compassion in superintelligent systems ignores how groups (corporations, nations) embed harmful incentives.
* **“Do not trust your eyes”: AI generates surge in expense fraud** – A discussion on how generative AI is being used to automate fraudulent reimbursement claims, raising new auditing challenges.
* **The Case That A.I. Is Thinking** – A heated debate whether LLMs genuinely “think” or simply mimic reasoning; many say we’re confusing style for substance. 
* **Who uses open LLMs and coding assistants locally? Share setup and laptop** – A surprisingly popular Ask-HN thread where devs share how they run open-source models and coding agents offline.
* **The trust collapse: Infinite AI content is awful** – Community-wide lament that the flood of AI-generated content is eroding trust, quality and attention online.

If you want to receive the next issues, subscribe [here](https://hnxai.eo.page/9h7q4).",alexeestec,1oqrlv4,GenAI4all,07-11-2025,11:10:11,https://www.reddit.com/r/GenAI4all/comments/1oqrlv4/why_everyone_dies_gets_agi_all_wrong_do_not_trust/
OpenAl just acquired the team behind Apple's Shortcuts. Here's why it matters.,"OpenAl just acquired Software Applications Incorporated, the startup behind unreleased Mac automation tool Sky - bringing on the team that created the iOS app (Workflow) that eventually became Apple Shortcuts after a 2017 acquisition.

Sky operates as a floating Al interface on Mac desktops, analyzing screen content and executing tasks across applications.

OAI plans to integrate Sky's macOS capabilities into ChatGPT, potentially enabling the assistant to control desktop apps and automate workflows natively. 

The acquisition comes on the heels of OpenAl's Atlas browser release this week, which is currently a Mac-only application.

The move also adds to OpenAl's list of recent acqui-hires that includes startups Statsig, Context Al, Roi, Multi, Crossing Minds, and Alex.",Minimum_Minimum4577,1oqljam,GenAI4all,07-11-2025,04:59:27,https://i.redd.it/0vqaewn8orzf1.jpeg
15 Best AI Video Generator - I tested them all,"|**Platform**|**Developer**|**Key Features**|**Best Use Cases**|**Pricing**|**Free Plan**|
|:-|:-|:-|:-|:-|:-|
||
|[Slop Club](https://slop.club/)|Slop Club|Utilizes Wan2.2 and GPT-image, social elements and remixing|Images/videos, memes, social creativity, prompt exploration.|Free SFW. Paid NSFW w/ daily free gens|Yes|
|**Veo**|Google DeepMind|Physics-based motion, cinematic rendering|Storytelling, Cinematic Production|Free (invite-only beta)|Yes (invite-based)|
|**Sora**|OpenAI|ChatGPT integration, easy prompting|Quick Video Sketching, Concept Testing|Included with ChatGPT Plus ($20/month)|Yes (with ChatGPT Plus)|
|**Dream Machine**|[Luma Labs](https://lumalabs.ai/)|Photorealism, image-to-video|Short Cinematic Clips, Visual Art|Free (limited use)|Yes (no watermark)|
|**Runway**|Runway|Multi-motion brush, fine-grain control|Creative Editing, Experimental Projects|125 free credits, \~$15+/month plans|Yes (credits-based)|
|**Hailuo AI**|Hailuo|Template-based editing, fast generation|Marketing, Product Onboarding|< $15/month|Yes|
|**Kling AI**|Kling|Physics engine, 3D motion realism|Action Simulation, Product Demos|Custom pricing (B2B); Free limited version|Yes|
|**revid AI**|revid|End-to-end Shorts creation, trend templates|TikTok, Reels, YouTube Shorts|\~$10–$39/month|Yes|
|**Colossyan**|Colossyan|Interactive training, scenario-based learning|Corporate Training, eLearning|\~$28–$100+/month (team-size dependent)|Yes (limited)|
|[HeyGen](http://heygen.com/)|HeyGen|Auto video translation, intuitive UI|Marketing, UGC, Global Video Localization|\~$29–$119/month (varies by plan)|Yes (limited)|
|**Haiper AI**|Haiper|Multi-modal input, creative freedom|Student Use, Creative Experimentation|Free with limits; Paid upgrade available|Yes (10/day)|
|**Synthesia**|Synthesia|Large avatar/voice library, enterprise features|Corporate Training, Global Content|\~$30–$100+/month|Yes (3 mins trial)|
|**HubSpot Clip**|HubSpot|Text to slide video, marketing templates|Blog-to-Video, Quick Explainers|Free with HubSpot account|Yes|

I've evaluated 15 tools based on real world testing, UI/UX walkthroughs, pricing breakdowns, and hands on results from automation features (URL to video, prompt generation, avatar quality, and more)

I've linked my most used / favorites in the table as well. My go-to as of rn is [slop.club](http://slop.club/) though.",Educational_Wash_448,1oqib60,GenAI4all,07-11-2025,02:16:53,https://www.reddit.com/r/GenAI4all/comments/1oqib60/15_best_ai_video_generator_i_tested_them_all/
How a Simple AI Automation Saved a Team from Hiring Extra Help,"I heard a project manager at a coffee shop worrying a few weeks stressing about missed requests across emails, forms, and chats. I offer to assist and said that I had been testing AI process automations.

A few days later, I set up a system that flags unattended objects, automatically logs, classifies, and routes requests, and even prioritezes recurring delays. It took roughly 30 minutes.

After a week, she told me that her team's performance had much improved and they didn't need to hire extra help. The AI simply made their current workflow; it wasn't a complete rewrite.

Automation with AI doesn't have to be complicated. Fixing one repetitive problem, and it can make a huge difference.",crowcanyonsoftware,1oq90yz,GenAI4all,06-11-2025,19:53:02,https://www.reddit.com/r/GenAI4all/comments/1oq90yz/how_a_simple_ai_automation_saved_a_team_from/
"AI Broke Interviews, AI's Dial-Up Era and many other AI-related links from Hacker News","Hey everyone, I just sent the issue #6 of the [Hacker News x AI newsletter](https://eomail4.com/web-version?p=01b6f55e-bb2d-11f0-bcb3-f3feb971b4f0&pt=campaign&t=1762449036&s=6c02d5c73d0e771e31a7b8cbd3d757a918a84b30ffe1f438d77c0ceface5e59f) \- a weekly roundup of the best AI links and the discussions around them from Hacker News. See below some of the news (AI-generated description):

*I also created a dedicated subreddit where I will post daily content from Hacker News. Join here:* [*https://www.reddit.com/r/HackerNewsAI/*](https://www.reddit.com/r/HackerNewsAI/)

* **AI’s Dial-Up Era** – A deep thread arguing we’re in the “mainframe era” of AI (big models, centralised), not the “personal computing era” yet.
* **AI Broke Interviews** – Discussion about how AI is changing software interviews and whether traditional leetcode-style rounds still make sense.
* **Developers are choosing older AI models** – Many devs say newer frontier models are less reliable and they’re reverting to older, more stable ones.
* **The trust collapse: Infinite AI content is awful** – A heated thread on how unlimited AI-generated content is degrading trust in media, online discourse and attention.
* **The new calculus of AI-based coding** – A piece prompting debate: claims of “10× productivity” with AI coding are met with scepticism and caution.

If you want to receive the next issues, subscribe [here](https://hnxai.eo.page/9h7q4).",alexeestec,1oq51kc,GenAI4all,06-11-2025,17:24:52,https://www.reddit.com/r/GenAI4all/comments/1oq51kc/ai_broke_interviews_ais_dialup_era_and_many_other/
I just finished reading the article “The AI Revolution Won’t Happen Overnight” in Harvard Business Review... and here’s my take: It’s refreshing to see a grounded perspective that challenges the hype-laden narrative of AI taking over everything at lightning speed. The author makes a compelling case,Here's the link if anyone wants to read it!,KarateLabs_,1opru1a,GenAI4all,06-11-2025,06:40:52,https://hbr.org/2025/06/the-ai-revolution-wont-happen-overnight?utm_medium=paidsearch&utm_source=google&utm_campaign=intlcontent_businessmgmt&utm_term=Non-Brand&tpcc=intlcontent_businessmgmt&gad_source=1&gad_campaignid=20712984860&gbraid=0AAAAAD9b3uThw-WcYiQ2ukd5wY51WRNdI&gclid=Cj0KCQiAiKzIBhCOARIsAKpKLAONNBi4eEyWQneRVAuvpIQ9znYejn6Wzv_cGCpPD750sdedGce918gaAjr4EALw_wcB
How we finally stopped chasing lost requests,"Have you ever had an email request disappear? Requests were buried in threads at my consulting firm, updates never arrived, and chaos ruled.

Everything changed when we established a straightforward way to track progress. Suddenly, we knew who was doing what, deadlines were clear and the constant follow-ups had stopped.

It's amazing how much easier work feels when everyone can see what's going on.",crowcanyonsoftware,1op8l8t,GenAI4all,05-11-2025,17:07:23,https://www.reddit.com/r/GenAI4all/comments/1op8l8t/how_we_finally_stopped_chasing_lost_requests/
Deep dive into the MCP,"Have you checked out this workshop on the Model Context Protocol? There appears to be an offer currently running where you can get your pass at 35% OFF.

Just use the code **LIMITED35**. 

[https://www.eventbrite.com/e/model-context-protocol-mcp-mastery-workshop-tickets-1767893560229?aff=oddtdtcreator](https://www.eventbrite.com/e/model-context-protocol-mcp-mastery-workshop-tickets-1767893560229?aff=oddtdtcreator)",RonLaz123,1oo0lt1,GenAI4all,04-11-2025,06:48:41,https://i.redd.it/eczacdzys6zf1.png
What AI tools actually help you day to day?,"Hey everyone, been deep down the AI rabbit hole for a while and testing a lot of stuff out there. What are you guys using that actually make life easier? Curious are there any simple AI tools that helped you so much that you wish you had found it earlier? 

If you can share about the use cases, it will be super helpful",Special-Grocery6419,1onwa3u,GenAI4all,04-11-2025,02:54:08,https://www.reddit.com/r/GenAI4all/comments/1onwa3u/what_ai_tools_actually_help_you_day_to_day/
Ever Switched Service Desk Software? How Did It Impact Your Team?,"I was reading about a nonprofit that recently switched from one service desk platform to another, and it made me think that switching tools is more than a simple technology; it can entirely affect how a team operates.

For them, the new technology improved procedures, reduced delays, and freed them up to focus their time more on their primary goal rather than administrative issues.

I'm curious if you or your business have ever switched service desk software",crowcanyonsoftware,1onngb0,GenAI4all,03-11-2025,20:45:11,https://www.reddit.com/r/GenAI4all/comments/1onngb0/ever_switched_service_desk_software_how_did_it/
"Which cloud provider offers the best GenAI setup — AWS, Azure, or GCP?","Hey everyone,

I'm a newbie to both GenAI and cloud technology. I recently came across a GenAI project that’s running on AWS, and I learned that AWS provides access to multiple foundation models (like Claude, Titan, Llama, etc.) through Amazon Bedrock. From what I understand, it’s a managed service where you can experiment with different models without handling the infrastructure yourself.

Now, I noticed that Azure has its own setup — mainly the Azure OpenAI Service and Azure AI Studio, which offer GPT-4, GPT-4o, and other models. Similarly, Google Cloud’s Vertex AI Model Garden gives access to Gemini, Llama, Mistral, and more.

I’m curious about the real-world difference between these three. Specifically:

Which one gives better value for personal projects (ease of setup and experimentation)?

How do they compare in cost and pricing flexibility for small-scale use?

And from a career growth standpoint — which platform’s experience would look stronger for the future, considering GenAI roles are expanding fast?


I’m mainly learning for now, but I want to pick the one that would also make sense long-term for portfolio projects and future job opportunities.

Would love to hear your insights — which do you think is the better offer overall, and why?

Used gpt to frame it properly.",Neither_Fan_5017,1onimq9,GenAI4all,03-11-2025,17:50:03,https://www.reddit.com/r/GenAI4all/comments/1onimq9/which_cloud_provider_offers_the_best_genai_setup/
What’s the biggest real challenge your business is facing while trying to adopt AI?,"Lately, we’ve been seeing a lot of businesses rush to “implement AI” — but many hit unexpected roadblocks once the hype settles.  
  
Some common themes that keep coming up in our conversations:  
  
Teams struggle to identify where AI actually fits in their workflow.  
  
There’s fear that AI might replace more than it supports.  
  
Leaders want measurable ROI but don’t have clear metrics for AI success.  
  
Smaller businesses find integration costs and talent gaps overwhelming.  
  
What’s interesting is that the real challenge usually isn’t the tech — it’s the mindset, structure, or strategy around it.  
  
For those who’ve been exploring AI in their business:  
👉 What’s been your toughest challenge so far?  
👉 How are you approaching AI adoption without derailing existing processes?  
  
I’d love to hear from founders, managers, or anyone experimenting with AI at work.  
It’s one of those topics where everyone’s figuring it out together — and learning from each other’s experience feels more valuable than any trend article.",HiteshiTech,1on8dex,GenAI4all,03-11-2025,10:35:26,https://www.reddit.com/r/GenAI4all/comments/1on8dex/whats_the_biggest_real_challenge_your_business_is/
Building a small team for an experimental short film (AI + cinematic storytelling),"Hey everyone,
I’m putting together a tiny, passion-driven group to craft a visually poetic short film using new AI-cinematic tools. It’s less about tech demo, more about emotion—cinema that feels hand-made through code and imagination.
If you love film aesthetics, color, animation, sound, or storytelling—and you want to explore how AI can be used artistically—you’re welcome to join in. No rigid roles, just curious people building something beautiful together.
Drop a comment or DM if you’d like to collaborate or even just watch the process unfold. NB:, No payouts please because I'm a student.",FadilHere,1olwz2t,GenAI4all,01-11-2025,19:41:04,https://i.redd.it/jmop42v48pyf1.jpeg
GenAI image and video tools,What's your top 3 stack for GenAI image and video? Please don’t suggest your own products - I'm looking for the most widely used in the market to keep it simple,Legal-Monk-1853,1olbs8m,GenAI4all,01-11-2025,01:26:13,https://www.reddit.com/r/GenAI4all/comments/1olbs8m/genai_image_and_video_tools/
"AI Pullback Has Officially Started, GenAI Image Editing Showdown and many other AI links shared on Hacker News","Hey everyone! I just sent the 5th issue of my weekly [Hacker News x AI Newsletter](https://eomail4.com/web-version?p=6bbb8c20-b65b-11f0-a6a0-fdfd63c5ef08&pt=campaign&t=1761919882&s=94362c8bc74fb0348a9fd4f13de4a4bce9291a26c66f2eea940e118603b291fe) (over 30 of the best AI links and the discussions around them from the last week). Here are some highlights (AI generated):

* **GenAI Image Editing Showdown** – A comparison of major image-editing models shows messy behaviour around minor edits and strong debate on how much “text prompt → pixel change” should be expected. 
* A**I, Wikipedia, and uncorrected machine translations of vulnerable languages** – Discussion around how machine-translated content is flooding smaller-language Wikipedias, risking quality loss and cultural damage. 
* **ChatGPT’s Atlas: The Browser That’s Anti-Web** – Users raise serious concerns about a browser that funnels all browsing into an LLM, with privacy, lock-in, and web ecosystem risks front and centre. 
* **I’m drowning in AI features I never asked for and I hate it** – Many users feel forced into AI-driven UI changes across tools and OSes, with complaints about degraded experience rather than enhancement. 
* **AI Pullback Has Officially Started** – A skeptical take arguing that while AI hype is high, real value and ROI are lagging, provoking debate over whether a pull-back is underway. 

You can subscribe [here](https://hnxai.eo.page/9h7q4) for future issues.",alexeestec,1okwhd7,GenAI4all,31-10-2025,14:43:33,https://www.reddit.com/r/GenAI4all/comments/1okwhd7/ai_pullback_has_officially_started_genai_image/
LongCat Video AI Long length Video ComfyUI Free FP8 workflow. best memory Long Cat,LongCat Video 13.6B. Infinite length AI video generations. It can remember the the items from the start of the clip. The best Long length generation . Free open source software ComfyUI for Low Vram FP8. Fixed seed to undo sections of video and redo sections.,Maleficent-Tell-2718,1oks8o7,GenAI4all,31-10-2025,11:41:08,https://youtu.be/PskxLffIYAU?si=e9JuWUshAy_AI08b
real estate promo using ai video generator,"i recently tested how an ai video generator could handle real estate promos, and the result honestly looked like something from a professional agency.

i started by sourcing property photos from freepik, then brought them into [domoai](https://www.domoai.app/home?via=081621AUG%E2%81%A9) to animate the interiors and exteriors. the ai added smooth camera sweeps, lighting transitions, and depth effects that made the rooms feel like real walkthroughs. i finished it off with text overlays and captions in ⁦veed.io⁩.

what surprised me is how natural it looked once everything was stitched together. the ai understood angles and kept the transitions consistent between scenes. it didn’t feel like slideshow movement  it looked like a 3d camera exploring the property.

this kind of ai video generation could really change how agencies make listing videos. you don’t even need to hire videographers; you can make realistic tours straight from photos.

if you’re in marketing or real estate, this workflow is worth testing. it’s simple  freepik for visuals, [domoai](https://www.domoai.app/home?via=081621AUG%E2%81%A9) for animation, and ⁦veed.io⁩ for polish.

anyone else tried video to video tools for real estate editing? i’m curious how they compare.",Kylepots04,1okmm7q,GenAI4all,31-10-2025,05:44:05,https://www.reddit.com/r/GenAI4all/comments/1okmm7q/real_estate_promo_using_ai_video_generator/
I want to create an AI project(beginner),"I have looked in  chatgpt and stuff on what to do. But i want to have real people telling me what kind of stuff they would if they were in my shoes
shoes",Exact-Cress7633,1oklkmy,GenAI4all,31-10-2025,04:41:06,https://www.reddit.com/r/GenAI4all/comments/1oklkmy/i_want_to_create_an_ai_projectbeginner/
Mulesoft to Java code migration,"Hi all,

As a firm we wanted to move out of mulesoft and migrated the existing apis to java spring boot.

As in this GenAi world with lots of llms, did any one tried to get any prompt which will suffice this need?

Please do share your thoughts on this, is it possible for an ai agent to do so via a prompt or not?

Thanks in advance",Spiritual_Chair4093,1okcrbe,GenAI4all,30-10-2025,21:48:46,https://www.reddit.com/r/GenAI4all/comments/1okcrbe/mulesoft_to_java_code_migration/
Any AI certifications for corporate leaders,Hello! I work in the L+D division of my company and one of my goals in 2026 is to design a learning strategy with a focus on learning technology and AI. I'd like to personally get some sort of certification that is accredited. I'm looking for something that is catered towards users of AI rather than developers. I came across the CAITL from USAII which looks great but would love your thoughts and input on anything that's out there.,Stock_newbie_1977,1ok1taf,GenAI4all,30-10-2025,14:51:26,https://www.reddit.com/r/GenAI4all/comments/1ok1taf/any_ai_certifications_for_corporate_leaders/
Do you think NVIDIA is still undervalued — or near its growth limits?,"I’ve been told many times during the last year and a half to be careful about investing in NVIDIA because of the “AI bubble”, “NVIDIA is overvalued” or “It’s reached its peak”, etc. But I kept investing and I’m currently at a great profit percentage. Should we keep putting money on it? Nobody knows, it’s obvious, but I’m interested and understanding your view points. Thanks.   ",Wrong_Talk781,1ok1f7y,GenAI4all,30-10-2025,14:36:07,https://www.reddit.com/r/GenAI4all/comments/1ok1f7y/do_you_think_nvidia_is_still_undervalued_or_near/
Remix Cool AI VFX Effects With Your Own Character | Guide Below,"Hey everyone,

I’ve been experimenting with this on [VAKPix](https://vakpix.com/), and it’s kind of wild how realistic it looks (like actual camera footage). You don’t even need to know VFX... It’s all text-based!

You can just click on ""Remix Video"" button on following page and change the reference image to create the same video with your own character : [https://vakpix.com/video/d89191c3-1996-4bb4-8cdd-db19383cece7](https://vakpix.com/video/d89191c3-1996-4bb4-8cdd-db19383cece7)

Here are a few more examples I would like to share :

* [Cool explosion Video](https://vakpix.com/video/5f1c4b3e-a756-487c-ad9f-b5bd40126707)
* [Cinematic time lapse](https://vakpix.com/video/5c83df93-ce4d-4c89-8be8-4df2b087c04b)
* [Tiger companion](https://vakpix.com/video/5011018d-9bde-4304-a2fd-c189bdb3f089)
* [Melting cloths](https://vakpix.com/video/39b21cf7-f3af-4fa4-ba9e-dd8c31601450)

VAKPix uses existing models like Veo & Sora. The idea is to giveaway earnings share to creators every time someone remixes your video. You can find more info on [creator earnings program](https://vakpix.com/creator-program) page.

Worth it if you want to experiment with realistic AI visuals or create viral content.

If anyone else tries it, I’d love to see your remixes in the comments!

Thanks for attention! :-)  
",ThisIsCodeXpert,1ok1bm8,GenAI4all,30-10-2025,14:32:07,https://v.redd.it/wev54jz4f9yf1
"If your bot's dressed like this, you should worry about privacy","Neo by 1X is the world's first consumer-ready humanoid home robot, officially launched for pre-order on October 28, 2025, and designed to perform household chores and act as an AI-powered assistant. The robot operates using an advanced AI model that allows for conversational interaction and learning, marking a significant step from industrial robotics to integration into everyday home life.

A major feature of Neo's learning process is ""Expert Mode,"" which requires a ""Vetted"" human teleoperator from 1X to remotely control the robot and train it on new tasks. This raises privacy concerns, as it allows a remote human to see through the robot's cameras inside the user's home. To address this, 1X states that owners must give consent for a remote session, can set ""no-go zones,"" and have the option to blur people's faces. Despite these controls, the need for human-in-the-loop training means early adopters must accept that their home environment is visible to remote operators, a trade-off for the robot's improved autonomy over time.",srs890,1ojvfvy,GenAI4all,30-10-2025,09:53:33,https://i.redd.it/gg2mrkrf18yf1.png
Abu Dhabi aims to become the world’s first fully AI‑native government by 2027.,"The Abu Dhabi Government Digital Strategy 2025–2027 aims to automate all public services using sovereign cloud computing, a unified ERP system, and over 200 AI solutions.

The plan includes an “AI for All” initiative to upskill citizens and enhance digital inclusion.

The strategy is expected to add AED 24 billion to GDP and create 5,000+ jobs, aligning with the UAE’s vision of an “AI-native” future, supported by institutions like MBZUAI and ATRC.",Minimum_Minimum4577,1ojrgf3,GenAI4all,30-10-2025,05:29:06,https://i.redd.it/rsfib9l7q6yf1.jpeg
Keeping up with all Gen AI tools,"How do you keep up with all the GenAI tools for Image, Video, 3D, and Audio?

There used to be an umbrella of industry standard software (like Adobe, Cinema 4D, DaVinci, and other VFX tools) that integrated seamlessly with each other.

Now, there are dozens of new tools to keep track of. You have to jump from one platform to another just to get something done, each tool being great at one specific thing then export, switch back, and repeat. And just when you get comfortable, there’s a new GenAI product promising to do at one thing better.

It honestly feels like a hassle sometimes like losing the creative flow.

How do you keep up? Or do you just stick to a few consistent tools (maybe five or fewer)?

Thanks",Legal-Monk-1853,1ojnm3x,GenAI4all,30-10-2025,02:05:17,https://www.reddit.com/r/GenAI4all/comments/1ojnm3x/keeping_up_with_all_gen_ai_tools/
