Title,Text,Username,ID,community,Date,Time,Post URL
Using GenAI as a tool to help combat information overload,"I am currently studying two post-grad courses at the same time, and also doing independent research. I am looking for ways to help manage information overload - I do NOT want GenAI to REPLACE the act of knowledge processing and learning, but I want it to AID me to be able to do it quicker.

Has anyone got any tips and advice on how to use GenAI tools to do this? Particularly ones that make your life simpler or integrate smoothly with your notetaking system. Particularly anyone who works in academia and is very familiar with information overload.",planetwords,1pcw62t,GenAI4all,03-12-2025,05:46:39,https://www.reddit.com/r/GenAI4all/comments/1pcw62t/using_genai_as_a_tool_to_help_combat_information/
What happened to this community?,"This sub used to be a great place to come chat with people about cool AI stuff. Now its a flood of cheap ads for Kling. What happened?

Is no one making cool stuff with AI?",Silent-Indication496,1pcvirl,GenAI4all,03-12-2025,05:12:04,https://www.reddit.com/r/GenAI4all/comments/1pcvirl/what_happened_to_this_community/
"How to add ""Big Budget"" production value (Tanks, Snow, Night shoots) without the cost","Renting a tank or a rain machine for a music video shoot usually costs thousands of dollars. I tested if the new Kling O1 model on **Higgsfield** could fake it convincingly.

I took a standard daytime shot and used AI to relight it for ""Moonlight,"" add heavy snow, and swap the prop car for a military tank. The consistency on the crowd's clothing (getting covered in snow) is production-ready.

For indie directors, this is a way to get that ""major label"" look on a shoestring budget.

Tool used: Higgsfield Video Edit (link in comments)",thelost0_0_,1pcuy7x,GenAI4all,03-12-2025,04:42:09,https://v.redd.it/1xt8zs8r4x4g1
VFX Workflow: changing character costumes in post-production instead of on-set (Video-to-Video Test),"I’ve been testing workflows for music video production using the new Kling O1 model on **Higgsfield**.

Instead of reshooting with different costumes/masks, I tried using Video-to-Video to completely restyle the backup dancers. I turned the original monkey masks into Stop-Motion Puppets and 3D Characters just via prompting.

For low-budget productions, this capability to ""skin"" your actors in post could save a fortune on wardrobe and makeup departments.

Tool used: Higgsfield Video Edit (link in comments)",thelost0_0_,1pcuugk,GenAI4all,03-12-2025,04:36:47,https://v.redd.it/zr745ovw3x4g1
"Mood Killer or Masterpiece? AI swaps a peaceful setting for an active volcano, flawlessly rendering the light change.","This advanced video editing tool which I used, demonstrates its capacity for radical environmental transformation by flawlessly replacing the peaceful looking background with a terrifying, active **volcanic eruption**, simultaneously casting the ominous red and orange eruption glow across the scene.",Lit-On,1pcts0y,GenAI4all,03-12-2025,03:43:53,https://v.redd.it/yjfrvr6cuw4g1
Spot the Edit: How seamless is this video background replacement?,"Using advanced video editing tool, I managed to replace the background effectively, transforming the setting from a high-fantasy magical realm centered around a towering castle and swirling celestial phenomenon to a dense enchanted forest.",Lit-On,1pctnk0,GenAI4all,03-12-2025,03:38:03,https://v.redd.it/nq32o3s2tw4g1
"The Power of a Prompt: Seamlessly replacing the entire sky with the stunning, luminous Northern Lights.","This powerful demonstration of advanced video editing technique which I have created achieves spectacular environmental transformation by seamlessly swapping a simple sky with the dramatic, luminous spectacle of the Northern Lights, allowing creators to instantly impose extreme atmospheric effects onto any existing scene.",Lit-On,1pcsn3y,GenAI4all,03-12-2025,02:50:25,https://v.redd.it/s7xtr8lukw4g1
VFX Artists: The ultimate test of asset replacement fidelity—swapping a fluid element for a solid one seamlessly.,"This demonstration of advanced video editing which I created achieves highly complex asset replacement by seamlessly swapping a dynamic, water-flowing fountain with an intricate, static marble statue while perfectly maintaining the surrounding garden's lighting and atmosphere.",Lit-On,1pcsbwu,GenAI4all,03-12-2025,02:35:58,https://v.redd.it/bx0duinaiw4g1
When the VFX Team Decides the Prince Needs to Attend a Modern Gala Instead,"This video which I created of advanced generative AI in character redesign allows creators to instantly swap the male figure's detailed fantasy attire for a formal tuxedo, perfectly preserving the couple's intimate pose and the intricate, vine-covered background.",Lit-On,1pcrq6z,GenAI4all,03-12-2025,02:08:10,https://v.redd.it/780hxjtbdw4g1
WWF,"Easy can add any character in wwf video I add trump using Kling O1 on Higgsfield 
Guide in comment",memerwala_londa,1pcrcm8,GenAI4all,03-12-2025,01:51:04,https://v.redd.it/duxgvjieaw4g1
"This AI-generated video allows the artist to play on the moon, a rainforest, or a concert stage without leaving her seat","This advanced generative video technique flawlessly swaps the backdrop of a girl playing guitar, instantly transporting her performance from a mundane setting to a modern urban street, all while maintaining perfect lighting and realistic reflections on the guitar's surface.",Lit-On,1pcr95t,GenAI4all,03-12-2025,01:46:47,https://v.redd.it/broo2d0g9w4g1
"The cinematic power of AI: Instantly changing the scene's focus from a cozy table to a glowing, powerful artifact.","This is an advanced video editing technique that demonstrates AI's power to seamlessly swap a practical table light for a glowing blue magic orb, instantly shifting the mood and narrative of the high-fantasy scene with perfectly rendered, consistent lighting and reflections.",Lit-On,1pcqiwy,GenAI4all,03-12-2025,01:13:32,https://v.redd.it/pav7q94i3w4g1
Love this seamless transitions of characters and styles I made with Higgsfield Kling O1!,"Start with references: upload characters, outfits, props, or scenes and keep them consistent across all shots! [Give it a try! ](https://higgsfield.ai/video-edit) ",Visual-March545,1pcp44a,GenAI4all,03-12-2025,00:10:56,https://v.redd.it/a8q5a46jsv4g1
"On Higgsfield, Kling O1 eases everything.","Kling O1 on Higgsfield just launched!

Your surroundings now look like premium content.

Even traffic.

[Go test here](https://higgsfield.ai/video-edit)",Alejandromartinez-,1pcldrg,GenAI4all,02-12-2025,21:38:50,https://v.redd.it/koaruo4b1v4g1
Kling O1 simplifies all on Higgsfield.,"Kling O1 on Higgsfield went live!

Colors have no chill.

Depth and drama everywhere.

[Go test here](https://higgsfield.ai/video-edit)",Alejandromartinez-,1pcla0e,GenAI4all,02-12-2025,21:34:47,https://v.redd.it/gh8as7xk0v4g1
Using Kling O1 ensures Higgsfield is simpler.,"Kling O1 on Higgsfield is launched!

Even the sky is overdoing it now.

Cinematic mode is real.

[Go test here](https://higgsfield.ai/video-edit)",Alejandromartinez-,1pcl7eh,GenAI4all,02-12-2025,21:32:07,https://v.redd.it/149rb4y20v4g1
Stranger Things,"This video was in my storage for long time and finally I can post this ,not an expert in after effects but with the help of Kling O1 on Higgsfield I able to do day to sunset scene easily ,full guide in comment",memerwala_londa,1pcjc5d,GenAI4all,02-12-2025,20:21:35,https://v.redd.it/3v1dlicmnu4g1
Creating a top notch movie trailer in my own room. Hollywood's in trouble with Kling 01 on Higgsfield..,All of this masterpiece is created using [Kling 01 on Higgsfield](https://higgsfield.ai/video-edit),crash_testdummy,1pci5ln,GenAI4all,02-12-2025,19:37:15,https://v.redd.it/js6dfoqifu4g1
A city built above the clouds.,"Feels like stepping into a dream that never ends.

",SeparatePeak598,1pchdb9,GenAI4all,02-12-2025,19:08:29,https://v.redd.it/twujf1d4au4g1
Just a good day with the best co-pilot 🐾🚲,"Sunshine, fresh air, and endless smiles.

",SeparatePeak598,1pch1r0,GenAI4all,02-12-2025,18:57:00,https://v.redd.it/crsjzqd68u4g1
Lost in her own frequency.,"Neon lights, soft beats, and a world on pause.

",SeparatePeak598,1pcgvi8,GenAI4all,02-12-2025,18:50:43,https://v.redd.it/bpeskdd57u4g1
Night rides hit different under city lights 🌃🏍️,"Speed, silence, and the sound of freedom.

",SeparatePeak598,1pcgqe9,GenAI4all,02-12-2025,18:45:34,https://v.redd.it/urtebo4g6u4g1
Grace with claws 💫,"Power doesn’t need to roar but when it does, it shines.

",SeparatePeak598,1pcgn6e,GenAI4all,02-12-2025,18:42:18,https://v.redd.it/a544d1gu5u4g1
"A city that never sleeps, and a soul that never stops 🌃","One person, one cart, and the moon as company.",SeparatePeak598,1pcgjkn,GenAI4all,02-12-2025,18:38:41,https://v.redd.it/j6uopwe45u4g1
Fast & Furriest: Road Edition 🏁😂,This little guy means business on the open road.,SeparatePeak598,1pcgfnk,GenAI4all,02-12-2025,18:34:37,https://v.redd.it/k99qsdqd4u4g1
That grin before everything burns 🔥,"Power, chaos, and style all in one look.

",SeparatePeak598,1pcg9b9,GenAI4all,02-12-2025,18:28:19,https://v.redd.it/n5dmujf83u4g1
Rocking under the desert sun 🎶☀️,"Old car, loud guitar, endless horizon.",SeparatePeak598,1pcg3ka,GenAI4all,02-12-2025,18:22:37,https://v.redd.it/k8d6xe572u4g1
"Prompt this, please!","If I wanted to achieve exact text on these product container, is it possible? Is there any other way to do it or a better/correct prompt? Thanks for your answers in advance. 🙂",The-BusyBee,1pcg2zo,GenAI4all,02-12-2025,18:22:03,https://i.redd.it/mhow8lqa2u4g1.jpeg
Midnight run through the city streets 🏁🌃,"Just speed, lights, and silence.

",SeparatePeak598,1pcfz2g,GenAI4all,02-12-2025,18:18:04,https://v.redd.it/0rt7mbff1u4g1
"Golden fields, soft light, calm strength 🌾✨","A quiet moment that feels straight out of a dream.

",SeparatePeak598,1pcft2s,GenAI4all,02-12-2025,18:12:03,https://v.redd.it/zugwg9qb0u4g1
The quietest view in the universe 🌌🚀,Just an astronaut watching Earth glow from above.,SeparatePeak598,1pcfo8j,GenAI4all,02-12-2025,18:07:15,https://v.redd.it/bjxy4yngzt4g1
Morning light over Rio ☀️🇧🇷,"Christ the Redeemer watching over a city just waking up.

",SeparatePeak598,1pcfjp8,GenAI4all,02-12-2025,18:02:49,https://v.redd.it/3qt88aptyt4g1
Shadow and fire in one frame 🐆🔥,The contrast says everything.,SeparatePeak598,1pcfc2g,GenAI4all,02-12-2025,17:55:24,https://v.redd.it/808ilrnixt4g1
"The Joker, a sunset, and a moment of silence 🌇💭","Not chaos this time, just calm before the night begins.",SeparatePeak598,1pcf79v,GenAI4all,02-12-2025,17:50:34,https://v.redd.it/yn6v2u84wt4g1
Walking into the light 🌕,A single step between night and infinity.,SeparatePeak598,1pcevpx,GenAI4all,02-12-2025,17:39:01,https://v.redd.it/z38tv5b1ut4g1
Evening ride into the sunset 🌻🚲,"Warm air, soft light, and the sound of birds, pure calm.

",SeparatePeak598,1pcepfs,GenAI4all,02-12-2025,17:32:51,https://v.redd.it/ewm0q9r9tt4g1
Even villains need to refuel sometimes ⛽💜,"The Joker, a purple car, and a quiet night, chaos can wait till morning.",SeparatePeak598,1pcel4c,GenAI4all,02-12-2025,17:28:33,https://v.redd.it/bv8qcjkjst4g1
"Evening walk by the sea, under a sky full of quiet stars 🌌🐾",A peaceful night scene with warm lights and soft waves.,SeparatePeak598,1pcegjj,GenAI4all,02-12-2025,17:23:58,https://v.redd.it/4sdemp0qrt4g1
Drone chase through the city at golden hour ☀️🏁,Two cars race side by side while a drone captures every moment.,SeparatePeak598,1pce9cl,GenAI4all,02-12-2025,17:16:51,https://v.redd.it/k8y8q74lqt4g1
Lost in a field of light and petals 🌷☁️,A calm moment surrounded by soft blossoms and glowing light.,SeparatePeak598,1pce238,GenAI4all,02-12-2025,17:09:26,https://v.redd.it/vzsydp67pt4g1
"The AI is Creating New Mythical Species: Behold the Cat-Nymph, flawlessly rendered.","This advanced video editing technique highlights the future of character design by flawlessly swapping the face of a nymph with that of a white kitten, seamlessly integrating the cat's fur and features with the human body's intricate jewelry and dramatic lighting.",Lit-On,1pcdw7p,GenAI4all,02-12-2025,17:03:31,https://v.redd.it/iimexf47ot4g1
A quiet tea party in the woods 🍵🦊,"A little fox enjoying a calm afternoon, pouring tea on a mossy tree stump.",SeparatePeak598,1pcdv2c,GenAI4all,02-12-2025,17:02:23,https://v.redd.it/ih81qr12ot4g1
POV: You're taking a train to the North Pole ❄️ (Generated this whole scene with AI),"I’m obsessed with how cozy this turned out. I used the new Kling O1 model on **Higgsfield** to generate a ""Winter Train Ride"" scene.

I didn't have to film anything. I just described the mood (""quiet, snowy, view from window""), and it created this relaxing loop. It captures that ""lo-fi winter"" vibe perfectly.

Tool used: Higgsfield Video Edit (link in comments)",thelost0_0_,1pcdlol,GenAI4all,02-12-2025,16:52:47,https://v.redd.it/6zqfj9ucmt4g1
"New York in miniature, sunset edition 🌇🗽",A tiny city floating on water with the Statue of Liberty and glowing bridges.,SeparatePeak598,1pcdlgs,GenAI4all,02-12-2025,16:52:35,https://v.redd.it/iynbedl8mt4g1
Kling O1 on Higgsfield Handles Warm Light & Soft Petals,"I tested Kling O1 on Higgsfield with a warm sakura car scene to evaluate how it handles glossy paint, organic textures, and soft falling petals.



The AI kept the reflections consistent, enhanced the light diffusion through the blossoms, and maintained clarity without oversharpening the soft pink hues [try now](https://higgsfield.ai/video-edit)",yashcodes,1pcdall,GenAI4all,02-12-2025,16:41:31,https://v.redd.it/rdlre826kt4g1
Kling O1 on Higgsfield: Mountain Cloudscape Test,"I tested Kling O1 on Higgsfield using a high-mountain winter scene to evaluate how it manages haze, reflective snow, and long-distance depth.

The AI kept the shadows natural, enhanced color harmony across the peaks, and maintained stable detail even in the brighter cloud areas.[try now](https://higgsfield.ai/video-edit)",yashcodes,1pcd7br,GenAI4all,02-12-2025,16:38:15,https://v.redd.it/pye3sm1njt4g1
Kling O1 on Higgsfield: Neon Rain Car Scene Test,"I tested Kling O1 on Higgsfield on a neon-lit rain scene to evaluate how well it handles specular highlights, saturated signs, and glossy surfaces.

The AI balanced the lighting perfectly, kept texture detail on the car, and prevented noise buildup in the fog-heavy background. [try now](https://higgsfield.ai/video-edit)",yashcodes,1pcd4bo,GenAI4all,02-12-2025,16:35:13,https://v.redd.it/axijptr6jt4g1
Kling O1 on Higgsfield: Forest Cabin Workspace Test,"I tested Kling O1 on Higgsfield using a forest-view cabin interior to evaluate how well it manages volumetric light, subtle reflections, and nature textures.

The AI kept the rays stable, enhanced color separation, and preserved depth in the trees without adding noise or oversharpening. [try now](https://higgsfield.ai/video-edit)",yashcodes,1pcd0yn,GenAI4all,02-12-2025,16:31:37,https://v.redd.it/s621r7qeit4g1
Kling O1 on Higgsfield: Coastal Workspace Test,"I tested Kling O1 on Higgsfield on a coastal workspace shot to evaluate how well it processes harsh sunlight, soft shadows, and detailed natural textures.

The AI handled the reflective ocean surface smoothly, maintained consistent color harmony, and kept all fine details intact without over-sharpening. [try now](https://higgsfield.ai/video-edit)",yashcodes,1pccyet,GenAI4all,02-12-2025,16:29:05,https://v.redd.it/m54szwm3it4g1
Kling O1 on Higgsfield: Cyberpunk Rain Atmosphere Test,"I tested Kling O1 on Higgsfield using a rainy high-rise scene to evaluate how well it manages low illumination, bright highlights, and dense atmospheric depth.

The AI kept the building geometry consistent, enhanced the glow naturally, and avoided banding in the fog-heavy areas. [try now](https://higgsfield.ai/video-edit)",yashcodes,1pccvmb,GenAI4all,02-12-2025,16:26:10,https://v.redd.it/vebvsl4kht4g1
Kling O1 on Higgsfield: Floating Cloud Bed Test,"I tested Kling O1 on Higgsfield with a dreamlike floating bed scene to evaluate how well it handles soft shadows, pastel skies, and water reflections.

The AI kept the subject stable, rendered smooth gradients, and enhanced cloud volume naturally without introducing artifacts. [try now](https://higgsfield.ai/video-edit)",yashcodes,1pcct4s,GenAI4all,02-12-2025,16:23:37,https://v.redd.it/068qf7f2ht4g1
Kling O1 on Higgsfield: Dreamy Balloon Atmosphere Test,"I tested Kling O1 on Higgsfield on an aerial balloon scene to see how well it manages sunlight diffusion, cloud depth, and calm subject motion.

The AI preserved geometry, kept lighting natural, and produced a stable output with no banding or hard edges. [try now](https://higgsfield.ai/video-edit)",yashcodes,1pccqa4,GenAI4all,02-12-2025,16:20:45,https://v.redd.it/wjw5vekggt4g1
Kling O1 on Higgsfield Enhances a Sky Hammock Moment,"I tested Kling O1 on Higgsfield using a floating hammock scene to evaluate how it manages atmospheric haze, aerial depth, and shifting sunlight.
The AI kept the cloud layers smooth, enhanced sky color separation, and maintained stable geometry even with subtle motion. [try now](https://higgsfield.ai/video-edit)",yashcodes,1pccmou,GenAI4all,02-12-2025,16:17:07,https://v.redd.it/6h10wbssft4g1
A staircase waiting for the moonrise,"Made with [Kling O1](https://higgsfield.ai/video-edit) on Higgsfield. The colors and the way the moon sits above the clouds give it a calm, surreal vibe.",Mysteriousnishu,1pcchc7,GenAI4all,02-12-2025,16:11:23,https://v.redd.it/0061bqvhet4g1
Kling O1 on Higgsfield Handles Calm Cinematic Aesthetics,"I tested **Kling O1 on Higgsfield** to see how well it handles fine texture, ambient particles, and warm lighting gradients in a stylized meadow scene.

The AI delivered smooth clouds, consistent depth, and natural atmospheric scatter without introducing noise or halo artifacts around the subject. \[try now\]:(https://higgsfield.ai/video-edit)",yashcodes,1pcc70x,GenAI4all,02-12-2025,16:00:35,https://v.redd.it/nq1i286tct4g1
Concept Artist 2.0: Look at the sheer detail and lighting control possible with AI-generated fantasy portraits.,"This stunning generative video demonstrates advanced AI control over feature blending, flawlessly merging the intricate face of a white cat onto a high-fantasy portrait while perfectly preserving the complex lighting and character detail.",Lit-On,1pcc3kj,GenAI4all,02-12-2025,15:56:52,https://v.redd.it/nkk5dra6ct4g1
Kling O1 on Higgsfield: Dreamy Spring Atmosphere Test,"I tested **Kling O1 on Higgsfield** on a sakura landscape to see how well it handles fine details like petals, thatched roofs, distant mountains, and warm ambient light.

The AI kept edge consistency, enhanced color harmony, and maintained depth without introducing noise or artificial textures. [try now](https://higgsfield.ai/video-edit)",yashcodes,1pcc2du,GenAI4all,02-12-2025,15:55:36,https://v.redd.it/nwk5o91sbt4g1
"Texture, Motion and Mood in One Small Test","Using Kling O1 on [Higgsfield](https://higgsfield.ai/video-edit), I tried combining texture-driven motion with a more atmospheric tone. It’s simple, but it helped me test how mood can be built through repetition and soft pacing.",Acceptable_Meat_8804,1pcaqju,GenAI4all,02-12-2025,15:04:31,https://v.redd.it/cqrvevby2t4g1
Testing narrative consistency: Keeping a character stable across 4 different eras (Kling O1),"I’ve been testing the new Kling O1 engine on **Higgsfield** to see if I could take a single ""traveling"" shot and place the character in different time periods without the face morphing.

I cycled this clip through a rural village, a modern city, a Japanese town, and a snowstorm. The ""MVL architecture"" kept the old man, the horses, and the cart structure locked in while completely changing the lighting and background assets.

For channels doing storytelling or history docs, this seems like a solid way to reuse character assets across different scenes.

Tool used: Higgsfield Video Edit (link in comments)",thelost0_0_,1pcafvc,GenAI4all,02-12-2025,14:52:37,https://v.redd.it/dg8eoumw0t4g1
"Above the Clouds, Kling O1 on Higgsfield Handles the Scene Perfectly","To explore atmospheric enhancement, I ran this serene cliffside hammock shot through **Kling O1 on Higgsfield**, focusing on color harmony, depth, and mood.

The model delivered a beautifully balanced scene, calm light, smooth clouds, and clean foreground details, while keeping the dreamy feel intact. [try now](https://higgsfield.ai/video-edit)",yashcodes,1pc947v,GenAI4all,02-12-2025,13:58:18,https://v.redd.it/kx9c0nxzqs4g1
Stop reading 2000-word articles. I built an AI that compresses them for you.,"I made a simple utility app that condenses long technical articles and AI releases into digestible summaries.

No walls, no clutter—just exactly what you need to know.

Perfect if you want to stay ahead of the curve but don't have time for full deep-dives every day.

Free to download — [https://play.google.com/store/apps/details?id=com.apdate.apdate](https://play.google.com/store/apps/details?id=com.apdate.apdate)

https://preview.redd.it/gzppvv9fas4g1.jpg?width=1080&format=pjpg&auto=webp&s=e3b9000561aa7daa715e8a8e7957dc462632e323

  
",Shoddy_Ad1207,1pc74b6,GenAI4all,02-12-2025,12:25:20,https://www.reddit.com/r/GenAI4all/comments/1pc74b6/stop_reading_2000word_articles_i_built_an_ai_that/
Reimagining live concert stage design using AI video layers (Kling O1),"I wanted to see if I could completely change the atmosphere of a live event without ruining the crowd's energy.

I took a clip of The Weeknd and used the new Kling O1 model on **Higgsfield** to swap the environment. It went from a sunny day to a red apocalyptic storm, and then to a night fireworks show.

The most impressive part is that it kept the crowd texture and the artist's dance moves consistent while relighting the entire scene.

Tool used: Higgsfield Video Edit (link in comments)",thelost0_0_,1pc702x,GenAI4all,02-12-2025,12:19:23,https://v.redd.it/xkwj4vtf9s4g1
I turned myself into Shrek with one prompt using Kling O1 on Higgsfield,"I used **Kling O1 on Higgsfield** on a simple waving clip of me and it turned me straight into Shrek. The skin, the textures, the lighting, everything switched over perfectly while still keeping my expression.

It is honestly insane how fast these transformations work now. One prompt and you are a completely different character.

Let me know if you want help, I generated it as I said on [Higgsfield](https://higgsfield.ai/video-edit/)",developAR,1pc5qby,GenAI4all,02-12-2025,11:07:30,https://v.redd.it/vyl3kf8bwr4g1
"Testing audio-driven lip sync on a puppet character (Kling O1 - Tyler, the Creator)","I’ve been testing the ""Audio to Video"" feature on the new Kling O1 engine (via **Higgsfield**). I wanted to see if it could handle lip-syncing on a non-human face.

I uploaded a puppet reference and used the audio track from ""Earfquake."" The model managed to match the mouth movements to the lyrics (""You make my earthquake"") surprisingly well, keeping the puppet texture consistent while the jaw moved.

Usually, models struggle with rigid puppet mouths, but this MVL architecture seems to handle the deformation correctly.

Tool used: Higgsfield Video Edit (link in comments)",thelost0_0_,1pc5mrb,GenAI4all,02-12-2025,11:01:31,https://v.redd.it/dxrel1cmvr4g1
Is it cheating to use AI? Or just… smart?,"One year ago, I spent a full day drawing a complex sequence diagram. A colleague asked:  
“Why not try ChatGPT?”  
My first reaction: *Isn’t that cheating?*  
15 minutes later, we had the same diagram ready using ChatGPT.

Fast forward a year. The same colleague called me:  
“I just generated 70 unit tests with GitHub Copilot coding agents. Found issues I would never have thought of, and solved problem that would occur in the future. Should I create a pull request—or will the team think it’s cheating?”

My answer: the same as his to me a year earlier.  
It’s not cheating. It’s efficiency.  
You turned a couple of days of work into one hour—and gained insights along the way.  
As long as you review and understand the output, it’s your work.  
Tell the team that you created it with help of AI, and be proud of it!

**The real question is not** ***if*** **we should use AI, but** ***how*** **we use it to deliver more value, faster.**",Adventurous-Win9143,1pc5cw8,GenAI4all,02-12-2025,10:45:10,https://www.reddit.com/r/GenAI4all/comments/1pc5cw8/is_it_cheating_to_use_ai_or_just_smart/
Still One of the Best Meme Ever.,I tried rebuilding this scene and it turned out way better than my expectations here at [Kling O1](http://Higgsfield.ai),No-Imagination7155,1pc55zg,GenAI4all,02-12-2025,10:33:08,https://v.redd.it/nux6pohmqr4g1
I turned my bike clip into a moon scene using one prompt with Kling O1,"I used **Kling O1 on Higgsfield** on this simple bike video I shot, and it completely swapped the whole environment into a moon surface. The rider stayed consistent, the shadows matched, and the motion stayed clean.

It is honestly crazy how easy it was. One prompt and the entire world changed. Generative video is moving fast and this kind of edit really shows it. You can try it from [here](https://higgsfield.ai/video-edit/)",developAR,1pc4thj,GenAI4all,02-12-2025,10:11:33,https://v.redd.it/rlokdhuomr4g1
